source,id,doi,pmid,title,abstract,authors,journal,year,doc_type,lang,url,pdf_url,oa_status,cited_by
openalex,W2023456789,10.1000/example1,"","Cognitive Behavioral Therapy for Depression: A Systematic Review","This systematic review examines the effectiveness of cognitive behavioral therapy (CBT) in treating depression. We analyzed 45 randomized controlled trials involving 3,200 participants. Results show that CBT is significantly more effective than control conditions for reducing depressive symptoms.","Smith, J.A.; Johnson, M.K.; Brown, S.L.","Journal of Clinical Psychology",2023,review,en,https://doi.org/10.1000/example1,https://example.com/paper1.pdf,gold,45
crossref,10.1000/example2,10.1000/example2,"","Machine Learning Applications in Mental Health Screening","Recent advances in machine learning have opened new possibilities for mental health screening and diagnosis. This paper reviews current applications of ML techniques including natural language processing and deep learning for analyzing patient data and predicting mental health outcomes.","Davis, R.M.; Wilson, K.J.; Thompson, L.P.","Journal of Medical Informatics",2022,journal-article,en,https://doi.org/10.1000/example2,"",closed,23
pubmed,12345678,10.1000/example3,12345678,"Effectiveness of Online CBT Interventions: A Meta-Analysis","The COVID-19 pandemic has accelerated the adoption of online therapy interventions. This meta-analysis evaluates the effectiveness of internet-delivered cognitive behavioral therapy compared to face-to-face therapy across 25 studies.","Garcia, M.A.; Lee, S.H.; Anderson, D.R.","Clinical Psychology Review",2021,review,en,https://pubmed.ncbi.nlm.nih.gov/12345678/,https://example.com/paper3.pdf,green,67
openalex,W2023456790,10.1000/example4,"","Depression Treatment Outcomes in Primary Care Settings","This longitudinal study follows 500 patients receiving depression treatment in primary care settings over 12 months. We examine treatment adherence, symptom improvement, and factors associated with positive outcomes.","Miller, P.K.; Jones, A.B.; White, C.D.","Primary Care Mental Health",2023,journal-article,en,https://doi.org/10.1000/example4,"",hybrid,12
crossref,10.1000/example5,10.1000/example5,"","Thérapie cognitivo-comportementale pour la dépression chez les adolescents","Cette étude examine l'efficacité de la thérapie cognitivo-comportementale (TCC) pour traiter la dépression chez les adolescents. Les résultats montrent une amélioration significative des symptômes dépressifs après 12 semaines de traitement.","Dubois, L.; Martin, F.; Rousseau, A.","Revue de Psychologie Clinique",2022,journal-article,fr,https://doi.org/10.1000/example5,https://example.com/paper5.pdf,gold,18
pubmed,87654321,"",87654321,"Neuroscience Basis of Cognitive Behavioral Therapy","Understanding the neural mechanisms underlying CBT can help optimize treatment protocols. This review synthesizes neuroimaging studies investigating brain changes associated with successful CBT treatment for depression and anxiety disorders.","Neural, B.R.; Cortex, F.L.; Synapse, N.T.","Nature Neuroscience",2023,review,en,https://pubmed.ncbi.nlm.nih.gov/87654321/,"",closed,89
openalex,W2023456791,10.1000/example6,"","Digital Health Interventions for Mental Health: A Scoping Review","Digital health technologies are increasingly used in mental health care. This scoping review maps the landscape of digital interventions including mobile apps, virtual reality, and AI-powered tools for mental health support.","Tech, D.I.; App, M.H.; Virtual, R.E.","Digital Health Journal",2023,review,en,https://doi.org/10.1000/example6,https://example.com/paper6.pdf,gold,34
crossref,10.1000/example7,10.1000/example7,"","Economic Evaluation of CBT vs Medication for Depression","This health economics study compares the cost-effectiveness of cognitive behavioral therapy versus antidepressant medication for treating depression in healthcare systems. Analysis includes direct costs, quality-adjusted life years, and long-term outcomes.","Economy, H.E.; Budget, C.A.; Value, Q.L.","Health Economics Review",2022,journal-article,en,https://doi.org/10.1000/example7,"",hybrid,29
